{
  "type": "custom",
  "title": "td element with a row header (scope=\"row\")",
  "description": "This test verifies that the row header is announced for associated td elements when the scope=\"row\" attribute is used.",
  "keywords": ["scope=\"row\""],
  "supports_sr": true,
  "supports_vc": false,
  "css_target": "#target",
  "sr_instructions": [
    "Use the screen reader to navigate to the target cell. The target cell contains the text \"target\"",
    "The test passes if the row header \"row one header\" was announced with the target cell."
  ],
  "vc_instructions": [],
  "history": [
    {
      "date": "2018-07-29",
      "message": "Sample data has been added. This data has not been verified."
    }
  ],
  "at": {

  }
}
