{
  "type": "custom",
  "title": "td element with a row header (th[scope=\"row\"])",
  "description": "This test verifies that the row header is announced for associated td elements when the scope=\"row\" attribute is used.",
  "keywords": ["scope=\"row\""],
  "supports_sr": true,
  "supports_vc": false,
  "css_target": "#target",
  "sr_instructions": [
    "Use the screen reader to navigate to the target cell. The target cell contains the text \"target\"",
    "The test passes if the row header \"row one header\" was announced with the target cell. If some commands work and others do not, the test should be marked as 'partial support'."
  ],
  "vc_instructions": [],
  "history": [
    {
      "date": "2018-07-29",
      "message": "Sample data has been added. This data has not been verified."
    }
  ],
  "at": {
    "vo_macos": {
      "browsers": {
        "safari": {
          "at_version": "10.13.6",
          "browser_version": "11.1.2",
          "os_version": "10.13.6",
          "support": "p",
          "date": "2018-07-29",
          "output": "target, column 2 of 2",
          "notes": "When the table is first announced by VO, it states that you can \"navigate the cells within this table by pressing Control-Option, and then Up Arrow, Down Arrow, Left Arrow, or Right Arrow\". When navigating by Control+Option + Left/Right Arrows, the test fails. The test passes when navigating by Control+Option Up/Down Arrows."
        }
      }
    }
  }
}
