{
  "type": "aam",
  "title": "Explicit label",
  "description": "This style of labeling depends on IDs.",
  "supports_sr": true,
  "supports_vc": true,
  "css_target": "#target",
  "expected": {
    "role": "textbox",
    "accessible_name": "Your name",
    "accessible_description": "",
    "states_and_properties": []
  },
  "history": [
    {
      "date": "2018-07-06",
      "message": "Sample data has been added. This data has not been verified."
    }
  ],
  "at": {
    "jaws": {
      "browsers": {
        "ie": {
          "at_version": "18",
          "browser_version": "11",
          "os_version": "17134",
          "support": "y",
          "date": "2018-07-21"
        },
        "edge": {
          "at_version": "18",
          "browser_version": "17",
          "os_version": "17134",
          "support": "y",
          "date": "2018-07-21"
        }
      }
    },
    "nvda": {
      "browsers": {
        "firefox": {
          "at_version": "2018.1.1",
          "browser_version": "60",
          "os_version": "17134",
          "support": "y",
          "date": "2018-07-21"
        }
      }
    },
    "vo_ios": {
      "browsers": {
        "ios_saf": {
          "at_version": "11.4",
          "browser_version": "11.4",
          "os_version": "11.4",
          "support": "y",
          "date": "2018-07-21"
        }
      }
    },
    "vo_macos": {
      "browsers": {
        "safari": {
          "at_version": "10.13.5",
          "browser_version": "11.1.1",
          "os_version": "10.13.5",
          "support": "y",
          "output": [
            {
              "command": "tab",
              "command_name": "next focusable item",
              "output": "your name, edit text",
              "result": "pass"
            }
          ],
          "date": "2018-07-21"
        }
      }
    },
    "narrator": {
      "browsers": {
        "edge": {
          "at_version": "10",
          "browser_version": "17",
          "os_version": "17134",
          "support": "y",
          "date": "2018-07-21"
        }
      }
    },
    "talkback": {
      "browsers": {
        "and_chr": {
          "at_version": "6.2",
          "browser_version": "67",
          "os_version": "8.1",
          "support": "y",
          "date": "2018-07-21"
        }
      }
    },
    "dragon_win": {
      "browsers": {
        "chrome": {
          "at_version": "13",
          "browser_version": "60",
          "os_version": "17134",
          "support": "y",
          "date": "2018-07-21"
        }
      }
    }
  }
}
