{
  "type": "external",
  "title": "aria alert role via DOM functions",
  "description": "Uses method 1: createElement(), insertAttribute(), createTextNode() and appendchild()",
  "url": {
    "title": "ARIA alert support - TPG Blog",
    "url": "https://developer.paciellogroup.com/blog/2017/04/aria-alert-support/"
  },
  "supports_sr": true,
  "supports_vc": false,
  "history": [
    {
      "date": "2018-07-21",
      "message": "Sample data has been added. This data has not been verified."
    }
  ],
  "at": {
    "jaws": {
      "browsers": {
        "firefox": {
          "at_version": "unknown",
          "browser_version": "unknown",
          "os_version": "unknown",
          "support": "y",
          "date": "2018-07-21"
        },
        "chrome": {
          "at_version": "unknown",
          "browser_version": "unknown",
          "os_version": "unknown",
          "support": "y",
          "date": "2018-07-21"
        },
        "ie": {
          "at_version": "unknown",
          "browser_version": "unknown",
          "os_version": "unknown",
          "support": "y",
          "date": "2018-07-21"
        },
        "edge": {
          "at_version": "unknown",
          "browser_version": "unknown",
          "os_version": "unknown",
          "support": "u",
          "date": "2018-07-21"
        }
      }
    },
    "nvda": {
      "browsers": {
        "firefox": {
          "at_version": "unknown",
          "browser_version": "unknown",
          "os_version": "unknown",
          "support": "y",
          "date": "2018-07-21"
        },
        "chrome": {
          "at_version": "unknown",
          "browser_version": "unknown",
          "os_version": "unknown",
          "support": "y",
          "date": "2018-07-21"
        },
        "ie": {
          "at_version": "unknown",
          "browser_version": "unknown",
          "os_version": "unknown",
          "support": "y",
          "date": "2018-07-21"
        },
        "edge": {
          "at_version": "unknown",
          "browser_version": "unknown",
          "os_version": "unknown",
          "support": "n",
          "date": "2018-07-21"
        }
      }
    },
    "vo_ios": {
      "browsers": {
        "ios_saf": {
          "at_version": "unknown",
          "browser_version": "unknown",
          "os_version": "unknown",
          "support": "y",
          "date": "2018-07-21"
        },
        "chrome": {
          "at_version": "unknown",
          "browser_version": "unknown",
          "os_version": "unknown",
          "support": "y",
          "date": "2018-07-21"
        },
        "firefox": {
          "at_version": "unknown",
          "browser_version": "unknown",
          "os_version": "unknown",
          "support": "y",
          "date": "2018-07-21"
        }
      }
    },
    "vo_macos": {
      "browsers": {
        "safari": {
          "at_version": "unknown",
          "browser_version": "unknown",
          "os_version": "unknown",
          "support": "y",
          "date": "2018-07-21"
        },
        "chrome": {
          "at_version": "unknown",
          "browser_version": "unknown",
          "os_version": "unknown",
          "support": "y",
          "date": "2018-07-21"
        }
      }
    },
    "narrator": {
      "browsers": {
        "ie": {
          "at_version": "unknown",
          "browser_version": "unknown",
          "os_version": "unknown",
          "support": "n",
          "date": "2018-07-21"
        },
        "edge": {
          "at_version": "unknown",
          "browser_version": "unknown",
          "os_version": "unknown",
          "support": "n",
          "date": "2018-07-21"
        }
      }
    }
  }
}
