{
  "type": "aam",
  "title": "Standard test",
  "description": "This test uses ::before and ::after pseudo classes to add content to static text",
  "supports_sr": true,
  "supports_vc": false,
  "css_target": "#target",
  "expected": {
    "role": "",
    "accessible_name": "This is generated content.",
    "accessible_description": "",
    "states_and_properties": []
  },
  "history": [
    {
      "date": "2018-07-06",
      "message": "Sample data has been added. This data has not been verified."
    }
  ],
  "at": {
    "jaws": {
      "browsers": {
        "firefox": {
          "at_version": "18",
          "browser_version": "60",
          "os_version": "17134",
          "support": "y",
          "output": [
            {
              "command": "down arrow",
              "command_name": "read next item",
              "output": "This is generated content.",
              "pass": "y"
            }
          ],
          "date": "2018-07-21"
        },
        "ie": {
          "at_version": "18",
          "browser_version": "11",
          "os_version": "17134",
          "support": "n",
          "output": [
            {
              "command": "down arrow",
              "command_name": "read next item",
              "output": "is generated",
              "pass": "n"
            }
          ],
          "date": "2018-07-21"
        },
        "edge": {
          "at_version": "18",
          "browser_version": "17",
          "os_version": "17134",
          "support": "y",
          "output": [
            {
              "command": "down arrow",
              "command_name": "read next item",
              "output": "This is generated content.",
              "result": "pass"
            }
          ],
          "date": "2018-07-21"
        }
      }
    },
    "nvda": {
      "browsers": {
        "firefox": {
          "at_version": "2018.1.1",
          "browser_version": "60",
          "os_version": "17134",
          "support": "y",
          "output": [
            {
              "command": "down arrow",
              "command_name": "read next item",
              "output": "This is generated content.",
              "result": "pass"
            }
          ],
          "date": "2018-07-21"
        }
      }
    }
  }
}
